{
  "version": 2,
  "pid": 1234,
  "profile": "default",
  "runtime_generation": "runtime-generation-1",
  "socket_path": "/private/var/folders/hermes/local/g-1234.sock",
  "instance_id": "11111111-1111-4111-8111-111111111111",
  "process_start_time_ns": 1785571200000000000,
  "process_executable": "/Applications/Hermes.app/Contents/MacOS/Hermes",
  "process_executable_device": 16777234,
  "process_executable_inode": 1234567,
  "host_bundle_id": "com.nousresearch.hermes"
}
